{
  "$schema": "https://json-schema.org/draft/2020-12/schema",
  "$id": "https://synchro.dev/conformance/schemas/support-matrix.schema.json",
  "title": "Synchro release support policy",
  "type": "object",
  "additionalProperties": false,
  "required": ["$schema", "schema_version", "release", "current_track_policy", "semantic_corpus_cell_ids", "cells"],
  "properties": {
    "$schema": { "const": "./schemas/support-matrix.schema.json" },
    "schema_version": { "const": 1 },
    "release": { "type": "string", "pattern": "^[0-9]+\\.[0-9]+\\.[0-9]+(-rc\\.[1-9][0-9]*)?$" },
    "current_track_policy": { "$ref": "#/$defs/currentTrackPolicy" },
    "semantic_corpus_cell_ids": { "$ref": "#/$defs/semanticCorpusCellIDs" },
    "cells": {
      "type": "array",
      "minItems": 1,
      "items": { "$ref": "#/$defs/supportCell" }
    }
  },
  "$defs": {
    "supportCellId": {
      "type": "string",
      "pattern": "^SUP-[A-Z0-9]+(?:-[A-Z0-9]+)*-[0-9]{3}$"
    },
    "currentTrackPolicy": {
      "type": "object",
      "additionalProperties": false,
      "required": ["selector", "resolve_at", "record_exact_versions_in"],
      "properties": {
        "selector": { "const": "current-stable" },
        "resolve_at": { "const": "release-candidate-start" },
        "record_exact_versions_in": { "const": "release-manifest.json" }
      }
    },
    "semanticCorpusCellIDs": {
      "type": "array",
      "minItems": 4,
      "maxItems": 4,
      "uniqueItems": true,
      "prefixItems": [
        { "const": "SUP-MACOS-CURRENT-001" },
        { "const": "SUP-ANDROID-CURRENT-001" },
        { "const": "SUP-RN-IOS-CURRENT-001" },
        { "const": "SUP-RN-ANDROID-CURRENT-001" }
      ],
      "items": false
    },
    "exactSelector": {
      "type": "object",
      "additionalProperties": false,
      "required": ["kind", "value"],
      "properties": {
        "kind": { "const": "exact" },
        "value": { "type": "string", "minLength": 1 }
      }
    },
    "minimumSelector": {
      "type": "object",
      "additionalProperties": false,
      "required": ["kind", "value"],
      "properties": {
        "kind": { "const": "minimum" },
        "value": { "type": "string", "minLength": 1 }
      }
    },
    "seriesSelector": {
      "type": "object",
      "additionalProperties": false,
      "required": ["kind", "value"],
      "properties": {
        "kind": { "const": "series" },
        "value": { "type": "string", "pattern": "^[0-9]+\\.[0-9]+\\.x$" }
      }
    },
    "currentSelector": {
      "type": "object",
      "additionalProperties": false,
      "required": ["kind"],
      "properties": {
        "kind": { "const": "current-stable" }
      }
    },
    "versionSelector": {
      "oneOf": [
        { "$ref": "#/$defs/exactSelector" },
        { "$ref": "#/$defs/minimumSelector" },
        { "$ref": "#/$defs/seriesSelector" },
        { "$ref": "#/$defs/currentSelector" }
      ]
    },
    "supportCell": {
      "type": "object",
      "additionalProperties": false,
      "required": ["id", "component", "platform", "policy"],
      "properties": {
        "id": { "$ref": "#/$defs/supportCellId" },
        "component": {
          "type": "string",
          "enum": [
            "postgresql-server",
            "swift-client",
            "kotlin-client",
            "react-native-client"
          ]
        },
        "platform": {
          "type": "string",
          "enum": ["postgresql", "ios", "macos", "android"]
        },
        "platform_version": { "$ref": "#/$defs/versionSelector" },
        "runtime_version": { "$ref": "#/$defs/versionSelector" },
        "extension_architecture": {
          "type": "string",
          "enum": ["linux-x64", "macos-arm64"]
        },
        "policy": { "type": "string", "enum": ["required", "tested", "excluded"] },
        "note": { "type": "string", "minLength": 1 }
      },
      "anyOf": [
        { "required": ["platform_version"] },
        { "required": ["runtime_version"] }
      ],
      "allOf": [
        {
          "if": {
            "properties": { "component": { "const": "react-native-client" } },
            "required": ["component"]
          },
          "then": { "required": ["platform_version", "runtime_version"] }
        },
        {
          "if": {
            "properties": {
              "component": { "const": "postgresql-server" },
              "policy": { "const": "required" }
            },
            "required": ["component", "policy"]
          },
          "then": { "required": ["extension_architecture"] },
          "else": { "not": { "required": ["extension_architecture"] } }
        }
      ]
    }
  }
}
